{
  "schemaVersion": "1.0",
  "workflow": "api-contract-design",
  "runPath": "workflow/example-runs/2026-05-26-example",
  "sourceArtifact": null,
  "domainModules": [],
  "executionMode": "full",
  "status": "completed",
  "currentStage": "summary",
  "latestDocument": null,
  "nextAction": "Review the summary.",
  "codeEditsAllowed": false,
  "riskLevel": "low",
  "riskReason": "Example workflow artifact.",
  "confirmationRequired": false,
  "rollbackRequired": false,
  "blockers": [],
  "selectedScope": null,
  "affectedServices": [],
  "affectedControllers": [],
  "affectedTables": [],
  "affectedCollections": [],
  "affectedTopics": [],
  "affectedConfigKeys": [],
  "updatedAt": "2026-05-26T00:00:00+08:00"
}
